line,start_time,end_time,text
1,"00:01:28,853","00:01:30,594",We're screwed.
2,"00:01:30,730","00:01:32,767",No more free wi-fi.
3,"00:01:33,900","00:01:35,436","- Hey, Ki-jung!
- Yeah?"
4,"00:01:36,110","00:01:39,729","The lady upstairs put
a password on 'iptime'."
5,"00:01:40,740","00:01:41,901",A password?
6,"00:01:42,033","00:01:43,695",Did you try 123456789?
7,"00:01:43,785","00:01:44,901",No luck.
8,"00:01:44,994","00:01:46,405",Do it the other way.
9,"00:01:46,496","00:01:48,078",I tried that too!
10,"00:01:48,373","00:01:52,162","Fuck, then we can't get WhatsApp?"
11,"00:01:52,252","00:01:53,618",Nothing.
12,"00:01:54,003","00:01:55,790","Hey, Kim Ki-taek."
13,"00:01:56,714","00:02:00,048","Don't fucking pretend to sleep.
What do you think?"
14,"00:02:00,718","00:02:06,385","Our phones are shut off.
Now our wifi is shut off."
15,"00:02:07,225","00:02:09,012",What's your plan?
16,"00:02:12,730","00:02:14,062","- Ki-woo.
- Yes, Dad?"
17,"00:02:14,148","00:02:17,687","For wifi, hold it high."
18,"00:02:19,112","00:02:22,856",Stick it in every corner and so on.
19,"00:02:26,661","00:02:30,450",Damn stink bugs.
20,"00:02:31,374","00:02:33,536",Over here! I got it!
21,"00:02:33,626","00:02:34,958",Really? You got a signal?
22,"00:02:35,044","00:02:36,785","Yeah, see?"
23,"00:02:36,963","00:02:39,501","This one, 'coffeeland 2G'."
24,"00:02:39,716","00:02:41,628",Did a new cafe open?
25,"00:02:41,843","00:02:43,425",Why can't I get it?
26,"00:02:43,511","00:02:45,093",Climb up here.
27,"00:02:45,179","00:02:46,465",Hey kids.
28,"00:02:47,307","00:02:48,923","- Does it work?
- Yeah."
29,"00:02:49,017","00:02:51,350",Then check WhatsApp.
30,"00:02:51,853","00:02:54,345",Pizza Generation said they'd contact me.
31,"00:02:54,814","00:02:56,100",Hold on.
32,"00:02:56,691","00:02:58,899",Here it is. Pizza Generation.
33,"00:03:02,238","00:03:05,231","Wow! Check this out, guys."
34,"00:03:06,034","00:03:09,243","If we go as fast as her,
we can finish today."
35,"00:03:09,329","00:03:10,615",Then we can get paid.
36,"00:03:10,705","00:03:13,823","- Should we stand up too?
- She's a pro."
37,"00:03:14,250","00:03:17,038",What? Fumigation?
38,"00:03:19,005","00:03:20,496",They still do that kind of thing?
39,"00:03:20,590","00:03:21,590",Guess so.
40,"00:03:21,633","00:03:22,466",Shut the window.
41,"00:03:22,467","00:03:24,959","Leave it open.
We'll get free extermination."
42,"00:03:25,178","00:03:26,635",Kill the stink bugs.
43,"00:03:26,846","00:03:29,384","Right, too many stink bugs
these days..."
44,"00:03:31,768","00:03:33,805","God, that smells!"
45,"00:03:36,564","00:03:38,271",I told you to shut it!
46,"00:03:38,524","00:03:40,311","Should I shut it, Dad?"
47,"00:03:51,162","00:03:53,245",What exactly is the problem?
48,"00:03:54,123","00:03:56,866",Take this one as an example.
49,"00:03:57,168","00:03:59,376",You call this a straight line?
50,"00:03:59,754","00:04:01,586",And why's it folded here?
51,"00:04:01,923","00:04:03,539",Why is this sticking up?
52,"00:04:03,716","00:04:06,049",You didn't even fold it.
53,"00:04:07,261","00:04:11,221",A quarter of them look like this.
54,"00:04:11,307","00:04:13,799",So 1 out of 4 are rejects.
55,"00:04:16,979","00:04:20,723","So you're really docking
10% off our pay?"
56,"00:04:21,150","00:04:24,643","Considering the rejects,
that's a low penalty, isn't it?"
57,"00:04:25,697","00:04:29,281","Our pay is so low already!
How can you do this?"
58,"00:04:30,868","00:04:32,109",Look here.
59,"00:04:32,328","00:04:34,786",This is not some minor issue.
60,"00:04:34,956","00:04:40,122","You know what one shitty box
can do to our brand image?"
61,"00:04:40,420","00:04:43,663","Brand? You can't even afford
a box folder!"
62,"00:04:43,756","00:04:45,167",What did you say?
63,"00:04:46,134","00:04:47,375",Boss.
64,"00:04:48,136","00:04:49,530","This is all because
of that guy, right?"
65,"00:04:49,554","00:04:50,554",What guy?
66,"00:04:50,638","00:04:54,302","Your part-time worker.
He's gone AWOL, right?"
67,"00:04:54,517","00:04:58,511","Just when the Love of God Church
made a huge group order?"
68,"00:04:58,771","00:05:00,854",How do you know all that?
69,"00:05:01,065","00:05:02,556",Who told you?
70,"00:05:02,900","00:05:04,641",My sister knows the guy.
71,"00:05:04,861","00:05:09,105","He's always been a bit strange.
Got a bad reputation."
72,"00:05:09,449","00:05:11,236","Speaking of which, Boss."
73,"00:05:11,951","00:05:14,034",We'll accept a 10% penalty.
74,"00:05:14,120","00:05:15,156",In return...
75,"00:05:15,246","00:05:16,327",In return?
76,"00:05:16,706","00:05:19,198","Any thought of hiring
a new part-time worker?"
77,"00:05:19,333","00:05:22,747","Sis, we need someone!"
78,"00:05:23,171","00:05:26,289","Ditch the guy you've got now.
Just fire him."
79,"00:05:27,008","00:05:30,297","Tomorrow I'll come for
a formal interview. What time?"
80,"00:05:30,386","00:05:31,877","Wait, hold on a sec."
81,"00:05:32,805","00:05:35,013",Let me think about it.
82,"00:05:35,349","00:05:38,433","Then for now,
just pay for the boxes."
83,"00:05:45,193","00:05:48,561","So we're all gathered here today,"
84,"00:05:49,113","00:05:52,652","to celebrate the reconnection
of our phones,"
85,"00:05:52,742","00:05:56,406",and this bounteous wi-fi!
86,"00:05:56,496","00:05:59,739","Look at that bastard.
It's not even dark yet."
87,"00:06:01,876","00:06:04,289","Why didn't you put up
a 'No Urinating' sign?"
88,"00:06:04,378","00:06:05,337",I told you!
89,"00:06:05,338","00:06:09,708","No, signs like that
just make them piss even more."
90,"00:06:10,051","00:06:11,883",At least shout at him!
91,"00:06:11,969","00:06:13,460",Don't shout.
92,"00:06:13,679","00:06:15,511","""Please don't piss!"""
93,"00:06:17,308","00:06:20,301","Hey, is that Min?"
94,"00:06:20,937","00:06:23,099","Hey mister, that's not a toilet."
95,"00:06:23,189","00:06:24,555","Way to go, Min."
96,"00:06:24,649","00:06:26,686","Hey, punk!"
97,"00:06:26,776","00:06:29,940","Who are you staring at, asshole?"
98,"00:06:30,196","00:06:33,360",Come here! You little shit.
99,"00:06:35,201","00:06:37,318",Get a fucking grip!
100,"00:06:38,538","00:06:40,825",That's an impressive friend.
101,"00:06:40,915","00:06:43,783","College students have
a real vigor to them."
102,"00:06:44,043","00:06:45,043",Not like my brother.
103,"00:06:45,127","00:06:48,461","But is he coming here?
Did you invite him?"
104,"00:06:48,548","00:06:49,629",No.
105,"00:06:49,757","00:06:50,838",Hello!
106,"00:06:50,925","00:06:52,461","Oh hi, Min!"
107,"00:06:52,802","00:06:53,802",Min!
108,"00:06:53,845","00:06:54,678","Are you well, sir?"
109,"00:06:54,679","00:06:57,217","- Sure.
- What are you doing here?"
110,"00:06:57,306","00:06:59,172",I texted you. Didn't you see it?
111,"00:06:59,517","00:07:00,678","Sorry, were you eating?"
112,"00:07:00,768","00:07:02,054","No, we weren't eating."
113,"00:07:02,144","00:07:04,431","- How are you, Ki-jung?
- Fine, you too?"
114,"00:07:04,522","00:07:07,230","We could've met outside,
why come here?"
115,"00:07:07,316","00:07:08,191",Because of this.
116,"00:07:08,192","00:07:10,980","It's for you,
but it's so heavy."
117,"00:07:11,112","00:07:13,445",Really? Put it down here.
118,"00:07:15,408","00:07:16,990","Wow, what is that?"
119,"00:07:17,076","00:07:18,692","When I said I was meeting Ki-woo,"
120,"00:07:18,786","00:07:22,245","my grandfather insisted
I bring this to you."
121,"00:07:26,210","00:07:28,543",Is this a landscape type?
122,"00:07:29,797","00:07:31,709","Or you can see it
as an abstract type."
123,"00:07:31,799","00:07:33,461","Wow, you know these!"
124,"00:07:33,551","00:07:37,545","My grandpa has collected scholar's rocks
since his cadet days."
125,"00:07:37,722","00:07:41,215","Now the annex, the study,
every room in the house"
126,"00:07:41,309","00:07:43,266",is filled with these things.
127,"00:07:43,561","00:07:47,350","But this stone here is said
to bring material wealth to families..."
128,"00:07:47,440","00:07:48,681",Min!
129,"00:07:48,941","00:07:51,809",This is so metaphorical.
130,"00:07:52,111","00:07:55,320","For sure.
It's a very opportune gift."
131,"00:07:55,406","00:07:56,281",Of course.
132,"00:07:56,282","00:08:00,276","Please relay our deepest
thanks to your grandpa."
133,"00:08:00,536","00:08:02,323",Food would be better.
134,"00:08:12,340","00:08:15,504","What was that called?
A landscape stone?"
135,"00:08:15,635","00:08:17,046",You collect those rocks too?
136,"00:08:17,136","00:08:21,881","Hey, thanks to that rock
I saw your parents, they look healthy."
137,"00:08:24,018","00:08:26,977","They're plenty healthy,
just out of work."
138,"00:08:29,440","00:08:31,682","Is Ki-jung taking lessons
these days?"
139,"00:08:32,902","00:08:35,690",She can't afford lessons.
140,"00:08:44,580","00:08:46,037","Cute, huh?"
141,"00:08:46,916","00:08:49,374",She's the one you're tutoring?
142,"00:08:49,502","00:08:51,619","Park Da-hye.
High school sophomore."
143,"00:08:52,046","00:08:55,210","You take over
as her English tutor."
144,"00:08:55,716","00:08:56,797",What do you mean?
145,"00:08:56,884","00:08:59,001","Tutor a rich kid.
It pays well."
146,"00:09:00,137","00:09:01,469",She's a nice girl.
147,"00:09:01,555","00:09:04,514","Look after her while
I'm studying abroad."
148,"00:09:05,351","00:09:08,685",What about your university friends?
149,"00:09:08,896","00:09:12,139",Why ask a loser like me?
150,"00:09:12,692","00:09:14,183",Why do you think?
151,"00:09:14,819","00:09:16,981",Just the thought makes me sick.
152,"00:09:17,154","00:09:21,319","Those disgusting frat boys
slavering over Da-hye?"
153,"00:09:21,409","00:09:23,150",It's revolting.
154,"00:09:29,166","00:09:30,327",You like her?
155,"00:09:35,423","00:09:37,540","Hey, I'm serious."
156,"00:09:38,801","00:09:42,886","When she enters university,
I'll officially ask her out."
157,"00:09:43,431","00:09:45,388","So you take care of
her until then."
158,"00:09:45,474","00:09:49,138","If it's you,
I can leave in peace."
159,"00:09:50,980","00:09:53,723","Thanks for your trust,"
160,"00:09:54,150","00:09:57,393","but do I have to pretend to be
a college student?"
161,"00:09:59,363","00:10:02,151","Ki-woo, think about it."
162,"00:10:02,867","00:10:06,326","For years including
your military service,"
163,"00:10:06,495","00:10:08,578","you took the university entrance
exam 4 times."
164,"00:10:08,873","00:10:11,832","Grammar, vocabulary,
composition, conversation..."
165,"00:10:12,418","00:10:14,034","When it comes to English,"
166,"00:10:14,128","00:10:18,589","you can teach 10 times better than
those drunken college pricks."
167,"00:10:19,884","00:10:22,342","- I guess so.
- Sure!"
168,"00:10:22,720","00:10:26,339","But will they hire me?
I'm not a college student."
169,"00:10:26,599","00:10:28,056",Just fake it.
170,"00:10:28,142","00:10:31,852","Don't worry, you'll have
my recommendation, plus..."
171,"00:10:32,938","00:10:35,351",How should I describe the mother...?
172,"00:10:37,943","00:10:39,354",She's a bit simple.
173,"00:10:39,528","00:10:40,689",Young and simple.
174,"00:10:40,780","00:10:41,987",Simple?
175,"00:10:42,364","00:10:43,821",What do you mean?
176,"00:10:43,949","00:10:47,863","Anyway, it's all good.
I had fun there."
177,"00:10:48,579","00:10:49,786",So you agree?
178,"00:10:49,872","00:10:51,329",I guess so.
179,"00:10:52,625","00:10:56,369","Hey, you said
your sister is artistic?"
180,"00:10:56,587","00:10:58,328",Good at Photoshop?
181,"00:11:00,966","00:11:05,051","God, with skills like this,
why can't you get into art school?"
182,"00:11:05,137","00:11:06,469",Shut up.
183,"00:11:08,933","00:11:11,175","Hey, no smoking in here."
184,"00:11:11,268","00:11:12,634","Yeah, yeah. Gimme that."
185,"00:11:12,728","00:11:13,844",Yeah.
186,"00:11:18,317","00:11:20,855",Now the cherry on top...
187,"00:11:22,404","00:11:26,899","Wow, does Oxford have
a major in document forgery?"
188,"00:11:27,201","00:11:30,444",Ki-jung would be top of her class.
189,"00:11:30,621","00:11:33,159","She's amazing, huh?"
190,"00:11:33,374","00:11:38,790","Our boy's going for a job interview.
Wish him luck."
191,"00:11:39,338","00:11:40,579",Son.
192,"00:11:41,507","00:11:44,250",I'm proud of you.
193,"00:11:44,593","00:11:45,709",Dad.
194,"00:11:46,595","00:11:49,588","I don't think of this
as forgery or crime."
195,"00:11:49,974","00:11:51,931","I'll go to this university
next year."
196,"00:11:52,017","00:11:55,385",So you've got a plan!
197,"00:11:55,729","00:11:59,268","I just printed out the document
a bit early."
198,"00:12:34,935","00:12:36,301",Who is it?
199,"00:12:36,562","00:12:38,554",Madame? Good afternoon.
200,"00:12:38,689","00:12:40,476",I'm here on Min's recommendation...
201,"00:12:40,566","00:12:42,307","Oh right, come in."
202,"00:12:43,611","00:12:44,977",Thank you.
203,"00:13:16,477","00:13:17,809",Hello!
204,"00:13:18,729","00:13:20,061","Hello, Madame."
205,"00:13:20,231","00:13:23,724","I just work here.
Come this way."
206,"00:13:24,151","00:13:25,767",The yard is so nice.
207,"00:13:25,861","00:13:27,523",The inside's nice too.
208,"00:13:27,863","00:13:31,231","You know the architect Namgoong?
He's famous."
209,"00:13:31,408","00:13:33,946",He used to live in this house.
210,"00:13:36,121","00:13:38,363",He designed it himself.
211,"00:13:41,210","00:13:46,330","As you can see,
now it's a playpen."
212,"00:13:46,674","00:13:48,040",This way.
213,"00:13:50,177","00:13:52,669","Sit yourself down here.
I'll bring the madame."
214,"00:13:52,763","00:13:53,970",Yes.
215,"00:14:06,110","00:14:07,271",Madame.
216,"00:14:08,362","00:14:09,478",Madame?
217,"00:14:12,199","00:14:13,315",Madame?
218,"00:14:15,327","00:14:16,568",Madame?
219,"00:14:20,207","00:14:22,415","He's here.
The tutoring candidate."
220,"00:14:26,130","00:14:28,372",I don't care about documents.
221,"00:14:28,924","00:14:31,337","Min recommended you, after all."
222,"00:14:32,219","00:14:38,090","As you know, Min is such
a brilliant human being."
223,"00:14:38,851","00:14:41,013","Da-hye and I were quite happy
with him."
224,"00:14:41,186","00:14:44,395","Regardless of her grades.
Know what I mean?"
225,"00:14:44,523","00:14:45,684",Yes.
226,"00:14:45,983","00:14:47,895",He was marvelous.
227,"00:14:47,985","00:14:54,983","So to be honest, we wanted to stick
with him through high school."
228,"00:14:55,743","00:14:58,611","But all of a sudden
he's going abroad."
229,"00:15:01,165","00:15:06,456","Anyway, excuse me,
but if I can speak directly,"
230,"00:15:06,712","00:15:11,548","if you're not up
to Min's level, then,"
231,"00:15:11,633","00:15:14,091","I'm not sure
what the point is."
232,"00:15:15,846","00:15:19,635","So anyway,
what I want to say is,"
233,"00:15:19,975","00:15:25,266","for your first lesson today,
do you mind if I sit in?"
234,"00:15:25,689","00:15:29,308","I want to see it full time,
how you run your lesson."
235,"00:15:31,487","00:15:33,524",Is it okay with you?
236,"00:16:01,892","00:16:03,929",You sure about #24?
237,"00:16:11,485","00:16:16,150","Da-hye, you solved those later problems
then went back to #24."
238,"00:16:16,448","00:16:17,814",Right?
239,"00:16:19,451","00:16:20,692",Yes.
240,"00:16:28,669","00:16:33,380","If that were the first question
on a real exam, you'd be screwed."
241,"00:16:34,550","00:16:37,714","Look at this.
Your pulse is racing."
242,"00:16:40,681","00:16:43,845",The heart doesn't lie.
243,"00:16:45,018","00:16:48,352","An exam is like slashing through
a jungle."
244,"00:16:48,522","00:16:51,014","Lose that momentum
and you're finished."
245,"00:16:51,442","00:16:53,775","The answer to #24?
I don't care."
246,"00:16:53,986","00:16:59,072","Slashing through the exam,
dominating it!"
247,"00:16:59,783","00:17:01,365",That's all I care about.
248,"00:17:02,619","00:17:06,033",What you need is vigor.
249,"00:17:07,541","00:17:08,748",Vigor.
250,"00:17:10,002","00:17:11,368",Understand?
251,"00:17:22,347","00:17:25,215","So I'll pay you
this time each month."
252,"00:17:25,309","00:17:28,598","3 classes a week,
2 hours each, okay?"
253,"00:17:29,313","00:17:30,429","As for the fee,"
254,"00:17:30,522","00:17:34,391","I was going to pay Min's rate,
then I added a bit for inflation."
255,"00:17:34,485","00:17:35,771",Thank you.
256,"00:17:36,987","00:17:39,320",How about a proper introduction?
257,"00:17:39,531","00:17:42,444","Da-hye's tutor,
we'll call him Kevin."
258,"00:17:42,993","00:17:44,655",Mr. Kevin!
259,"00:17:45,078","00:17:48,321","If you feel like snacking
during your lesson, just call me."
260,"00:17:48,790","00:17:50,827","If you need anything, ask her."
261,"00:17:50,918","00:17:53,456",She knows this house better than I...
262,"00:17:53,587","00:17:56,705","Da-song, stop it!"
263,"00:17:57,299","00:17:58,881","I'm sorry, did he startle you?"
264,"00:17:58,967","00:18:01,459",How cute. His name's Da-song?
265,"00:18:01,553","00:18:03,294","Yes, our youngest."
266,"00:18:03,514","00:18:05,096","Da-song, come say hi!"
267,"00:18:05,182","00:18:06,718",This is Mr. Kevin!
268,"00:18:08,977","00:18:13,597","This is an Indian arrow.
I ordered it from the U.S."
269,"00:18:13,690","00:18:16,433","From last year he's been
an Indian fanatic."
270,"00:18:18,445","00:18:19,856",Indians?
271,"00:18:20,614","00:18:23,277",He's got a fanboy personality?
272,"00:18:23,450","00:18:27,114","Well, he's eccentric
and easily distracted,"
273,"00:18:27,204","00:18:29,491",he can barely sit still!
274,"00:18:29,957","00:18:32,119","So last year I enrolled him
in Cub Scouts,"
275,"00:18:32,209","00:18:35,202","hoping he'd learn moderation
and focus."
276,"00:18:35,295","00:18:36,706",But look.
277,"00:18:37,506","00:18:39,042",He's even worse.
278,"00:18:41,593","00:18:46,463","His scout leader is an Indian fanatic,
maybe that's why."
279,"00:18:48,308","00:18:51,392","The American Indian is
the very spirit of the Cub Scouts."
280,"00:18:51,478","00:18:52,514",It's a good thing.
281,"00:18:52,604","00:18:55,563","Were you a Cub Scout, Kevin?"
282,"00:18:55,732","00:18:58,725","Sure, I'm a Scout by nature."
283,"00:18:59,027","00:19:03,112","Da-song is an artist by nature.
Look at this painting."
284,"00:19:03,991","00:19:06,950","It's so metaphorical.
It's really strong."
285,"00:19:07,286","00:19:08,743","Strong, right?"
286,"00:19:09,037","00:19:10,949",You've got an eye for this.
287,"00:19:12,457","00:19:14,039","It's a chimpanzee, right?"
288,"00:19:14,126","00:19:15,583",A self-portrait.
289,"00:19:18,797","00:19:20,208",Sure enough!
290,"00:19:21,425","00:19:24,793","The perspective of
a young artist eludes understanding."
291,"00:19:24,970","00:19:27,257","Or perhaps it's Da-song's
expressive genius..."
292,"00:19:27,639","00:19:32,725","Anyway, we've been through
so many art teachers."
293,"00:19:33,061","00:19:35,269",None of them lasts even a month.
294,"00:19:36,898","00:19:39,857","And Da-song is just so hard
to control."
295,"00:19:42,529","00:19:44,862","- Just a moment, Madame.
- Yes?"
296,"00:19:45,282","00:19:48,491",Someone just came to mind.
297,"00:19:49,161","00:19:50,743",What was her name?
298,"00:19:51,204","00:19:53,742","Jessica! Right, Jessica..."
299,"00:19:54,082","00:19:58,167","She was in the same art school
as my cousin."
300,"00:19:58,462","00:20:00,829",What was her Korean name?
301,"00:20:01,214","00:20:06,255","Anyway, after studying applied arts
at Illinois State University,"
302,"00:20:06,345","00:20:08,302",she returned to Korea.
303,"00:20:08,388","00:20:10,505",Illinois... tell me more.
304,"00:20:10,849","00:20:16,891","Her teaching is unusual,
but she knows how to handle kids."
305,"00:20:17,606","00:20:20,394","She's got a special reputation
in her field."
306,"00:20:20,776","00:20:23,189","But even though
her methods are unique,"
307,"00:20:23,278","00:20:25,816","she can help kids get
into good art schools."
308,"00:20:25,906","00:20:29,946","Now I'm really curious.
What is she like?"
309,"00:20:30,202","00:20:31,784",Would you like to meet her?
310,"00:20:32,079","00:20:35,163","Though I heard she's
in high demand..."
311,"00:20:41,380","00:20:42,621",Hold on.
312,"00:20:44,132","00:20:47,671","Jessica, only child,
Illinois Chicago,"
313,"00:20:47,761","00:20:50,629","classmate Kim Jin-mo,
he's your cousin."
314,"00:20:57,771","00:21:01,811","Look at how he painted the side
dishes on the tablecloth"
315,"00:21:01,942","00:21:04,309",in this mosaic arrangement.
316,"00:21:04,528","00:21:07,236","But within that too,
there are repeating patterns."
317,"00:21:07,406","00:21:10,490","Gochujang is red, the rice...
well, anyway,"
318,"00:21:10,575","00:21:15,491","he has a Basquiat-esque sense,
even at age 9!"
319,"00:21:15,956","00:21:17,413",How exciting.
320,"00:21:17,833","00:21:22,794","I'm sure Miss Jessica
must have already sensed this,"
321,"00:21:23,088","00:21:27,002","so I'll leave you two,
and go up for Da-hye's lesson."
322,"00:21:27,801","00:21:29,258","Have a nice lesson, Jessica."
323,"00:21:29,428","00:21:31,260","Yes, thank you for the introduction."
324,"00:21:35,308","00:21:40,679","So as you can see,
Da-song's eccentric genius..."
325,"00:21:43,442","00:21:44,649",Da-hye.
326,"00:21:44,985","00:21:48,023",So we'll start with #38?
327,"00:21:52,701","00:21:53,862",Kevin.
328,"00:21:53,994","00:21:55,155",Yeah?
329,"00:21:55,328","00:22:00,244","Did you know that Da-song is
faking it all?"
330,"00:22:00,709","00:22:03,076",Huh? What do you mean?
331,"00:22:03,336","00:22:04,998",It's all a show.
332,"00:22:05,213","00:22:08,957","Acting like a genius,
that 4th dimension stuff is all fake."
333,"00:22:09,050","00:22:10,757",An artist cosplay.
334,"00:22:10,969","00:22:12,460",Da-song?
335,"00:22:13,722","00:22:15,304","You know that thing,"
336,"00:22:15,390","00:22:19,509","when he freezes and stares at the sky,
as if struck by inspiration."
337,"00:22:20,187","00:22:25,728","So he's walking along, then he stares
at the clouds for 10 minutes."
338,"00:22:26,276","00:22:28,108",So you know what I mean?
339,"00:22:28,320","00:22:30,812",He gives me the creeps.
340,"00:22:30,989","00:22:34,107","He pretends that he can't live
a normal life."
341,"00:22:34,618","00:22:36,200",Makes me want to puke.
342,"00:22:36,286","00:22:39,324",So Da-song is pretending...
343,"00:22:40,081","00:22:43,825","But what's that got to do
with your studies?"
344,"00:22:47,923","00:22:51,792","Well, I'm just saying."
345,"00:22:54,221","00:22:56,383","Sure, so in that sense,"
346,"00:22:57,516","00:23:01,601","what you told me
about Da-song was very interesting,"
347,"00:23:02,103","00:23:03,969","so let's write about it
in English."
348,"00:23:04,397","00:23:10,234","And be sure to use the word 'pretend'
at least twice."
349,"00:23:10,904","00:23:13,942","Then, can I ask you a question?"
350,"00:23:14,032","00:23:15,148",Sure.
351,"00:23:15,242","00:23:17,734",That teacher Jessica.
352,"00:23:18,495","00:23:24,492",Is she really your cousin's classmate?
353,"00:23:26,753","00:23:28,210",What do you mean?
354,"00:23:28,463","00:23:30,580","She's your girlfriend, right?"
355,"00:23:33,677","00:23:37,717",No way... I just met her today.
356,"00:23:41,768","00:23:44,886","Jessica's really pretty,
isn't she?"
357,"00:23:45,564","00:23:47,476",Aren't you interested?
358,"00:23:48,650","00:23:50,232",You saw her?
359,"00:23:50,485","00:23:54,900","Sure, she's pretty.
She's a beautiful woman."
360,"00:23:55,031","00:23:56,238",Yeah.
361,"00:23:58,159","00:24:01,027",I knew it.
362,"00:24:01,913","00:24:03,870",So you are interested.
363,"00:24:06,668","00:24:08,000",Da-hye...
364,"00:24:10,547","00:24:17,386","So, if we can compare Jessica
to a rose,"
365,"00:24:17,470","00:24:18,961",then you are...
366,"00:25:04,851","00:25:06,513","- Let's study.
- Yes."
367,"00:25:06,603","00:25:11,815","Please understand that
my boy has trouble keeping still."
368,"00:25:11,900","00:25:13,266",I understand.
369,"00:25:13,652","00:25:14,893",Da-song!
370,"00:25:16,154","00:25:17,112","Da-song, get up!"
371,"00:25:17,113","00:25:18,695","Come on, Da-song!"
372,"00:25:18,907","00:25:20,614",In your butt...
373,"00:25:20,700","00:25:23,113","- Madame, please leave us.
- What?"
374,"00:25:23,620","00:25:26,237","I never teach with a parent
in the room."
375,"00:25:26,498","00:25:28,911","But today is our first day,
and as you can see, he's..."
376,"00:25:29,000","00:25:30,707",Wait downstairs.
377,"00:25:32,170","00:25:33,456",Park Da-song?
378,"00:25:33,546","00:25:34,662",Da-song!
379,"00:25:38,677","00:25:39,918",Madame?
380,"00:25:41,096","00:25:42,553",Want some plum extract?
381,"00:25:42,639","00:25:43,675",What?
382,"00:25:43,848","00:25:46,966","It's mixed with honey.
To ease your tension."
383,"00:25:47,102","00:25:49,014","Yeah, that would be great."
384,"00:26:04,077","00:26:05,818","- Hey.
- Yes?"
385,"00:26:06,204","00:26:07,570",I've got an idea.
386,"00:26:07,664","00:26:10,828","Take two glasses of plum
extract to Da-song's room."
387,"00:26:11,084","00:26:14,077","You're not a parent,
so you can go in!"
388,"00:26:14,170","00:26:15,661","Oh, that's right!"
389,"00:26:15,797","00:26:18,881","Then I'll report back on
what's going on in there..."
390,"00:26:19,551","00:26:21,258",Why didn't I think of it earlier?
391,"00:26:23,763","00:26:24,879",What?
392,"00:26:25,140","00:26:26,381",They came out?
393,"00:26:26,891","00:26:27,891",Yeah.
394,"00:26:30,228","00:26:33,312",So you're done already?
395,"00:26:34,733","00:26:35,974",Madame.
396,"00:26:36,651","00:26:38,608",Come sit next to me.
397,"00:26:40,613","00:26:42,400","Da-song, go upstairs."
